{
  "entity": "workflow_revision",
  "path_pattern": "^workflows/(?<id>[a-z0-9][a-z0-9_-]*)/(?<revision>[0-9]+\\.[0-9]+\\.[0-9]+)/(?<file>[a-z_]+\\.json)$",
  "path_params": ["id", "revision", "file"],
  "files": {
    "metadata.json": {
      "schema": "luma-forge://schemas/bundled/workflow_metadata.schema.json"
    },
    "model_assets.json": {
      "schema": "luma-forge://schemas/bundled/workflow_model_assets.schema.json"
    },
    "contract_requirements.json": {
      "schema": "luma-forge://schemas/bundled/workflow_contract_requirements.schema.json"
    },
    "execution_contract.json": {
      "schema": "luma-forge://schemas/bundled/workflow_execution_contract.schema.json"
    },
    "workflow.json": {
      "schema": "luma-forge://schemas/bundled/workflow_graph.schema.json"
    }
  }
}
