{
  "entity": "execution_schema",
  "path_pattern": "^execution_schemas/(?<id>[a-z0-9][a-z0-9_-]*)/(?<revision>[0-9]+\\.[0-9]+\\.[0-9]+)\\.json$",
  "path_params": ["id", "revision"],
  "files": {
    "__self__": {
      "schema": "luma-forge://schemas/bundled/execution_schema.schema.json"
    }
  }
}
